{
 "archives": [
  {
   "file": "ui-ux-design-0.1.0-dev.zip",
   "sha256": "d55a640ed3cf43ec4a7115c399fc82d57bd826051086cfcd80086f6f50e4d793",
   "size": 841293
  },
  {
   "file": "ui-ux-design-0.1.0-dev.tar.gz",
   "sha256": "e36dc6f63394bf6f9d7bf288677601074e763461fed20fd04251b4f378b05de0",
   "size": 576186
  }
 ],
 "build_mode": "dev",
 "content_sha256": "2165098cdde20a26d9d32beb7fa1faca41862abaed39edd557d633a240badaae",
 "environment": {
  "implementation": "CPython",
  "platform": "Windows-10-10.0.26200-SP0",
  "python": "3.11.9",
  "zlib": "1.3.1"
 },
 "name": "ui-ux-design",
 "release": false,
 "schema_version": 1,
 "source": {
  "commit": "fe1ea5f0b335e570879fee4e0443d83e68f26b80",
  "kind": "working-tree",
  "worktree_clean": false
 },
 "source_date_epoch": 315619200,
 "tool": {
  "archive_format_version": 1,
  "name": "plugin/packaging/build.py"
 },
 "version": "0.1.0"
}
